{"id":"UI-CUSTOMER-ORDER-ICON-NEGIMA","sourceRevision":1,"runtimeBuild":1,"status":"approved","screenUnit":"SCR-SVC-CUSTOMERS","profile":"standalone-raster","pack":"core","kind":"image","colorSpace":"sRGB","alpha":"straight","lossPolicy":"lossless-required","pivot":{"x":0.5,"y":0.5},"anchors":[],"clips":[],"mirrorSafe":false,"source":"ARTSRC:UI-CUSTOMER-ORDER-ICON-NEGIMA:R1","provenance":"PROV:UI-CUSTOMER-ORDER-ICON-NEGIMA:R1","license":"YAKI SEASON internal approved artwork","specRefs":["ART-003 v5.0.0","UI-002 v5.24.1"],"reviewedAt":"2026-07-28"}
