{"id":"BG-SERVICE-TABLE-ARTIST009","sourceRevision":1,"runtimeBuild":1,"status":"approved","screenUnit":"SCR-SVC-CUSTOMERS","profile":"complete-layer","pack":"core","kind":"image","colorSpace":"sRGB","alpha":"straight","lossPolicy":"lossless-required","pivot":{"x":0,"y":0},"anchors":[],"clips":[],"mirrorSafe":false,"source":"ARTSRC:BG-SERVICE-TABLE-ARTIST009:R1","provenance":"PROV:BG-SERVICE-TABLE-ARTIST009:R1","license":"YAKI SEASON internal approved artwork","specRefs":["ART-003 v5.0.0","ART-002 v3.6.1"],"reviewedAt":"2026-07-28"}
