{
  "id": "BG-WORKSPACE-GRILL",
  "sourceRevision": 1,
  "runtimeBuild": 1,
  "status": "approved",
  "screenUnit": "SCR-SVC-GRILL",
  "profile": "complete-layer",
  "pack": "core",
  "kind": "image",
  "colorSpace": "sRGB",
  "alpha": "none",
  "lossPolicy": "lossless-required",
  "pivot": { "x": 0, "y": 0 },
  "anchors": [],
  "clips": [],
  "mirrorSafe": false,
  "source": "ARTSRC:BG-WORKSPACE-GRILL:R1",
  "provenance": "PROV:BG-WORKSPACE-GRILL:R1",
  "license": "YAKI SEASON internal approved artwork",
  "specRefs": ["ART-003 v5.9.0", "ART-002 v3.6.1"],
  "reviewedAt": "2026-07-29"
}
