{
  "id": "D1-TSUKIOKA-RECEIVED-EATING",
  "sourceRevision": 2,
  "runtimeBuild": 1,
  "status": "approved",
  "screenUnit": "SCR-SVC-CUSTOMERS",
  "profile": "bundle-model",
  "pack": "core",
  "kind": "image",
  "colorSpace": "sRGB",
  "alpha": "straight",
  "lossPolicy": "lossless-required",
  "pivot": {"x": 0, "y": 0},
  "anchors": [{"id": "person-center-fhd", "x": 1086, "y": 560}, {"id": "logical-seat-anchor-fhd", "x": 1086, "y": 594}],
  "clips": ["eat-negima", "drink-draft-beer"],
  "mirrorSafe": false,
  "source": "ARTSRC:D1-TSUKIOKA-RECEIVED-EATING:R2",
  "provenance": "PROV:D1-TSUKIOKA-RECEIVED-EATING:R2",
  "license": "YAKI SEASON internal approved artwork",
  "specRefs": ["ART-003", "GPL-003"],
  "reviewedAt": "2026-08-03"
}
