{
  "id": "BG-INTERIOR-BASE",
  "sourceRevision": 1,
  "runtimeBuild": 1,
  "status": "approved",
  "screenUnit": "SCR-SVC-CUSTOMERS",
  "profile": "standalone-raster",
  "pack": "core",
  "kind": "image",
  "colorSpace": "sRGB",
  "alpha": "none",
  "lossPolicy": "lossless-required",
  "pivot": { "x": 0, "y": 0 },
  "anchors": [],
  "clips": [],
  "mirrorSafe": false,
  "source": "ARTSRC:BG-INTERIOR-BASE:R1",
  "provenance": "PROV:BG-INTERIOR-BASE:R1",
  "license": "YAKI SEASON internal approved artwork",
  "specRefs": ["ART-003 v5.9.0", "ART-002 v3.6.1"],
  "reviewedAt": "2026-08-03"
}
