{
  "id": "BG-WORKSPACE-DRINK",
  "sourceRevision": 2,
  "runtimeBuild": 1,
  "status": "approved",
  "screenUnit": "SCR-SVC-DRINK",
  "profile": "complete-layer",
  "pack": "core",
  "kind": "image",
  "colorSpace": "sRGB",
  "alpha": "none",
  "lossPolicy": "lossless-required",
  "pivot": {
    "x": 0,
    "y": 0
  },
  "anchors": [],
  "clips": [],
  "mirrorSafe": false,
  "source": "ARTSRC:BG-WORKSPACE-DRINK:R2",
  "provenance": "PROV:BG-WORKSPACE-DRINK:R2",
  "license": "YAKI SEASON internal approved artwork",
  "specRefs": [
    "ART-003 v5.9.0",
    "UI-003 v1.2.0",
    "Developer 2 task 007 binding contract v1.0.0"
  ],
  "reviewedAt": "2026-07-30"
}
