{"id":"D1-TSUKIOKA-RECEIVED-EATING","sourceRevision":1,"runtimeBuild":1,"status":"approved","screenUnit":"SCR-SVC-CUSTOMERS","profile":"bundle-model","pack":"core","kind":"image","colorSpace":"sRGB","alpha":"straight","lossPolicy":"lossless-required","pivot":{"x":0,"y":0},"anchors":[],"clips":["eat-negima","drink-draft-beer"],"mirrorSafe":false,"source":"ARTSRC:D1-TSUKIOKA-RECEIVED-EATING:R1","provenance":"PROV:D1-TSUKIOKA-RECEIVED-EATING:R1","license":"YAKI SEASON internal approved artwork","specRefs":["ART-003 v5.0.0","GPL-003 v4.11.0"],"reviewedAt":"2026-07-28"}
