{
  "id": "MDL-SKEWER-BASE",
  "sourceRevision": 2,
  "runtimeBuild": 1,
  "status": "approved",
  "screenUnit": "SCR-SVC-ASSEMBLY",
  "profile": "bundle-model",
  "pack": "core",
  "kind": "model",
  "colorSpace": "not-applicable",
  "alpha": "not-applicable",
  "lossPolicy": "lossless-required",
  "pivot": {
    "x": 0,
    "y": 0,
    "z": 0
  },
  "bounds": {
    "min": {
      "x": -0.0515,
      "y": -0.82,
      "z": -0.0385
    },
    "max": {
      "x": 0.0515,
      "y": 0.82,
      "z": 0.0385
    }
  },
  "anchors": [],
  "clips": [],
  "mirrorSafe": false,
  "source": "ARTSRC:MDL-SKEWER-BASE:R2",
  "provenance": "PROV:MDL-SKEWER-BASE:R2",
  "license": "YAKI SEASON internal approved artwork",
  "specRefs": [
    "ART-003 v5.9.0"
  ],
  "reviewedAt": "2026-07-29"
}
